[
  {
    "canonical_route": "/services/dpiit-startup-india.html",
    "service_id": "V01-SVC-001",
    "service_name": "DPIIT Startup India Recognition & Section 56(2)(viib) Exemption",
    "record_status": "ACTIVE_SERVICE",
    "primary_vertical_id": "V01",
    "related_vertical_ids": [],
    "scope_boundary": "No checkpoint-driven ID change. Keep one canonical primary vertical; represent adjacent ownership only with secondary related-service links.",
    "source_evidence": "review-output/phase-1-foundations/phase-1-service-ownership-review.csv (Row 2); docs/phase-1-route-register.csv; services/dpiit-startup-india.html",
    "verification_status": "VERIFIED_APPROVED"
  },
  {
    "canonical_route": "/services/llp-registration.html",
    "service_id": "V01-SVC-002",
    "service_name": "Limited Liability Partnership (LLP) Registration",
    "record_status": "ACTIVE_SERVICE",
    "primary_vertical_id": "V01",
    "related_vertical_ids": [],
    "scope_boundary": "No checkpoint-driven ID change. Keep one canonical primary vertical; represent adjacent ownership only with secondary related-service links.",
    "source_evidence": "review-output/phase-1-foundations/phase-1-service-ownership-review.csv (Row 3); docs/phase-1-route-register.csv; services/llp-registration.html",
    "verification_status": "VERIFIED_APPROVED"
  },
  {
    "canonical_route": "/services/msme-udyam.html",
    "service_id": "V01-SVC-003",
    "service_name": "MSME / Udyam Registration Online",
    "record_status": "ACTIVE_SERVICE",
    "primary_vertical_id": "V01",
    "related_vertical_ids": [],
    "scope_boundary": "No checkpoint-driven ID change. Keep one canonical primary vertical; represent adjacent ownership only with secondary related-service links.",
    "source_evidence": "review-output/phase-1-foundations/phase-1-service-ownership-review.csv (Row 4); docs/phase-1-route-register.csv; services/msme-udyam.html",
    "verification_status": "VERIFIED_APPROVED"
  },
  {
    "canonical_route": "/services/opc-registration.html",
    "service_id": "V01-SVC-004",
    "service_name": "One Person Company (OPC) Registration",
    "record_status": "ACTIVE_SERVICE",
    "primary_vertical_id": "V01",
    "related_vertical_ids": [],
    "scope_boundary": "No checkpoint-driven ID change. Keep one canonical primary vertical; represent adjacent ownership only with secondary related-service links.",
    "source_evidence": "review-output/phase-1-foundations/phase-1-service-ownership-review.csv (Row 5); docs/phase-1-route-register.csv; services/opc-registration.html",
    "verification_status": "VERIFIED_APPROVED"
  },
  {
    "canonical_route": "/services/partnership-registration.html",
    "service_id": "V01-SVC-005",
    "service_name": "Partnership Firm Registration",
    "record_status": "ACTIVE_SERVICE",
    "primary_vertical_id": "V01",
    "related_vertical_ids": [],
    "scope_boundary": "No checkpoint-driven ID change. Keep one canonical primary vertical; represent adjacent ownership only with secondary related-service links.",
    "source_evidence": "review-output/phase-1-foundations/phase-1-service-ownership-review.csv (Row 6); docs/phase-1-route-register.csv; services/partnership-registration.html",
    "verification_status": "VERIFIED_APPROVED"
  },
  {
    "canonical_route": "/services/proprietorship-registration.html",
    "service_id": "V01-SVC-006",
    "service_name": "Sole Proprietorship Registration",
    "record_status": "ACTIVE_SERVICE",
    "primary_vertical_id": "V01",
    "related_vertical_ids": [],
    "scope_boundary": "No checkpoint-driven ID change. Keep one canonical primary vertical; represent adjacent ownership only with secondary related-service links.",
    "source_evidence": "review-output/phase-1-foundations/phase-1-service-ownership-review.csv (Row 7); docs/phase-1-route-register.csv; services/proprietorship-registration.html",
    "verification_status": "VERIFIED_APPROVED"
  },
  {
    "canonical_route": "/services/pvt-ltd-registration.html",
    "service_id": "V01-SVC-007",
    "service_name": "Private Limited Company Registration (SPICe+)",
    "record_status": "ACTIVE_SERVICE",
    "primary_vertical_id": "V01",
    "related_vertical_ids": [],
    "scope_boundary": "No checkpoint-driven ID change. Keep one canonical primary vertical; represent adjacent ownership only with secondary related-service links.",
    "source_evidence": "review-output/phase-1-foundations/phase-1-service-ownership-review.csv (Row 8); docs/phase-1-route-register.csv; services/pvt-ltd-registration.html",
    "verification_status": "VERIFIED_APPROVED"
  },
  {
    "canonical_route": "/services/section-8-registration.html",
    "service_id": "V01-SVC-008",
    "service_name": "Section 8 Company / Non-Profit Registration",
    "record_status": "ACTIVE_SERVICE",
    "primary_vertical_id": "V01",
    "related_vertical_ids": [],
    "scope_boundary": "No checkpoint-driven ID change. Keep one canonical primary vertical; represent adjacent ownership only with secondary related-service links.",
    "source_evidence": "review-output/phase-1-foundations/phase-1-service-ownership-review.csv (Row 9); docs/phase-1-route-register.csv; services/section-8-registration.html",
    "verification_status": "VERIFIED_APPROVED"
  },
  {
    "canonical_route": "/services/society-registration.html",
    "service_id": "V01-SVC-009",
    "service_name": "Society Registration",
    "record_status": "ACTIVE_SERVICE",
    "primary_vertical_id": "V01",
    "related_vertical_ids": [],
    "scope_boundary": "No checkpoint-driven ID change. Keep one canonical primary vertical; represent adjacent ownership only with secondary related-service links.",
    "source_evidence": "review-output/phase-1-foundations/phase-1-service-ownership-review.csv (Row 10); docs/phase-1-route-register.csv; services/society-registration.html",
    "verification_status": "VERIFIED_APPROVED"
  },
  {
    "canonical_route": "/services/trust-registration.html",
    "service_id": "V01-SVC-010",
    "service_name": "Charitable Trust Registration",
    "record_status": "ACTIVE_SERVICE",
    "primary_vertical_id": "V01",
    "related_vertical_ids": [],
    "scope_boundary": "No checkpoint-driven ID change. Keep one canonical primary vertical; represent adjacent ownership only with secondary related-service links.",
    "source_evidence": "review-output/phase-1-foundations/phase-1-service-ownership-review.csv (Row 11); docs/phase-1-route-register.csv; services/trust-registration.html",
    "verification_status": "VERIFIED_APPROVED"
  },
  {
    "canonical_route": "/services/aoc4-xbrl.html",
    "service_id": "V02-SVC-001",
    "service_name": "AOC-4 XBRL Financial Tagging & Filing",
    "record_status": "ACTIVE_SERVICE",
    "primary_vertical_id": "V02",
    "related_vertical_ids": [],
    "scope_boundary": "No checkpoint-driven ID change. Keep one canonical primary vertical; represent adjacent ownership only with secondary related-service links.",
    "source_evidence": "review-output/phase-1-foundations/phase-1-service-ownership-review.csv (Row 12); docs/phase-1-route-register.csv; services/aoc4-xbrl.html",
    "verification_status": "VERIFIED_APPROVED"
  },
  {
    "canonical_route": "/services/dir3-kyc.html",
    "service_id": "V02-SVC-002",
    "service_name": "DIR-3 KYC Annual Director Verification",
    "record_status": "ACTIVE_SERVICE",
    "primary_vertical_id": "V02",
    "related_vertical_ids": [],
    "scope_boundary": "No checkpoint-driven ID change. Keep one canonical primary vertical; represent adjacent ownership only with secondary related-service links.",
    "source_evidence": "review-output/phase-1-foundations/phase-1-service-ownership-review.csv (Row 13); docs/phase-1-route-register.csv; services/dir3-kyc.html",
    "verification_status": "VERIFIED_APPROVED"
  },
  {
    "canonical_route": "/services/form-adt1.html",
    "service_id": "V02-SVC-003",
    "service_name": "Form ADT-1 Statutory Auditor Appointment",
    "record_status": "ACTIVE_SERVICE",
    "primary_vertical_id": "V02",
    "related_vertical_ids": [],
    "scope_boundary": "No checkpoint-driven ID change. Keep one canonical primary vertical; represent adjacent ownership only with secondary related-service links.",
    "source_evidence": "review-output/phase-1-foundations/phase-1-service-ownership-review.csv (Row 14); docs/phase-1-route-register.csv; services/form-adt1.html",
    "verification_status": "VERIFIED_APPROVED"
  },
  {
    "canonical_route": "/services/form-aoc4.html",
    "service_id": "V02-SVC-004",
    "service_name": "Form AOC-4 Financial Statements Filing",
    "record_status": "ACTIVE_SERVICE",
    "primary_vertical_id": "V02",
    "related_vertical_ids": [],
    "scope_boundary": "No checkpoint-driven ID change. Keep one canonical primary vertical; represent adjacent ownership only with secondary related-service links.",
    "source_evidence": "review-output/phase-1-foundations/phase-1-service-ownership-review.csv (Row 15); docs/phase-1-route-register.csv; services/form-aoc4.html",
    "verification_status": "VERIFIED_APPROVED"
  },
  {
    "canonical_route": "/services/form-ben2.html",
    "service_id": "V02-SVC-005",
    "service_name": "Form BEN-2 Significant Beneficial Ownership (SBO)",
    "record_status": "ACTIVE_SERVICE",
    "primary_vertical_id": "V02",
    "related_vertical_ids": [
      "V11"
    ],
    "scope_boundary": "Retain V02 approved as canonical primary for MCA filing; link beneficial-ownership governance to V11 secondarily.",
    "source_evidence": "review-output/phase-1-foundations/phase-1-service-ownership-review.csv (Row 16); docs/phase-1-route-register.csv; services/form-ben2.html",
    "verification_status": "VERIFIED_APPROVED"
  },
  {
    "canonical_route": "/services/form-dpt3.html",
    "service_id": "V02-SVC-006",
    "service_name": "Form DPT-3 Return of Deposits & Loans",
    "record_status": "ACTIVE_SERVICE",
    "primary_vertical_id": "V02",